{
  "$schema": "https://json-schema.org/draft/2020-12/schema",
  "$id": "https://gen1recomp.local/schemas/runtime-capability-report.schema.json",
  "title": "Gen1Recomp love.js Functional Capability Report",
  "$defs": {
    "check": {
      "type": "object",
      "additionalProperties": false,
      "required": ["status", "observed"],
      "properties": {
        "status": { "enum": ["pass", "fail", "unavailable", "error"] },
        "observed": true
      }
    }
  },
  "type": "object",
  "additionalProperties": false,
  "required": ["schemaVersion", "purpose", "sessionId", "runtimeRevision", "observedAt", "environment", "checks"],
  "properties": {
    "schemaVersion": { "const": 1 },
    "purpose": { "enum": ["live-activation", "archival"] },
    "sessionId": {
      "type": "string",
      "pattern": "^[A-Za-z0-9][A-Za-z0-9._:-]{0,127}$"
    },
    "runtimeRevision": {
      "type": "string",
      "pattern": "^[0-9a-f]{40}$"
    },
    "observedAt": {
      "type": "string",
      "pattern": "^[0-9]{4}-[0-9]{2}-[0-9]{2}T[0-9]{2}:[0-9]{2}:[0-9]{2}(\\.[0-9]{3})?Z$"
    },
    "environment": {
      "type": "object",
      "additionalProperties": false,
      "required": ["host", "hostVersion", "osVersion", "renderer"],
      "properties": {
        "host": { "enum": ["outside-browser", "scripting-webview"] },
        "hostVersion": { "type": "string", "minLength": 1 },
        "osVersion": { "type": ["string", "null"] },
        "renderer": { "type": ["string", "null"] }
      }
    },
    "checks": {
      "type": "object",
      "minProperties": 1,
      "propertyNames": {
        "enum": [
          "runtime.love11_5",
          "lua.version51",
          "lua.setfenv",
          "lua.loadstring",
          "lua.bit",
          "lua.coroutine",
          "web.wasm",
          "web.crossOriginIsolated",
          "graphics.webgl1",
          "graphics.webgl2",
          "graphics.canvas",
          "graphics.imageData",
          "graphics.shader",
          "loop.fixedStep",
          "storage.session",
          "storage.explicitSync",
          "audio.queueableBuffer",
          "input.touchNamespace",
          "input.simultaneousTouch",
          "input.joystickNamespace",
          "thread.channel",
          "thread.workerRoundtrip"
        ]
      },
      "additionalProperties": { "$ref": "#/$defs/check" }
    }
  }
}
